{
  "schema_version": "0.1",
  "calendar": {
    "weeks": 1,
    "slots": [{ "id": "mon-1", "day": "monday", "index": 1 }]
  },
  "groups": [{ "id": "g1" }, { "id": "g2" }],
  "teachers": [{ "id": "busy", "name": "Один преподаватель" }],
  "rooms": [{ "id": "101" }, { "id": "102" }],
  "subjects": [{ "id": "a" }, { "id": "b" }],
  "lesson_demands": [
    {
      "id": "d1",
      "group_id": "g1",
      "subject_id": "a",
      "teacher_id": "busy",
      "room_id": "101",
      "hours_per_week": 1
    },
    {
      "id": "d2",
      "group_id": "g2",
      "subject_id": "b",
      "teacher_id": "busy",
      "room_id": "102",
      "hours_per_week": 1
    }
  ],
  "constraints": { "hard": [], "soft": [] },
  "solver_config": { "mode": "solve", "time_limit_sec": 10 }
}
