{
  "schema_version": "0.1",
  "calendar": {
    "weeks": 1,
    "slots": [{ "id": "mon-1", "day": "monday", "index": 1 }]
  },
  "groups": [{ "id": "g1" }],
  "teachers": [{ "id": "mgr", "managed_room_ids": ["own-219"] }],
  "rooms": [{ "id": "own-219" }, { "id": "other-101" }],
  "subjects": [{ "id": "s1" }],
  "lesson_demands": [
    {
      "id": "wrong-room",
      "group_id": "g1",
      "subject_id": "s1",
      "teacher_id": "mgr",
      "room_id": "other-101",
      "hours_per_week": 1
    }
  ],
  "constraints": { "hard": [], "soft": [] },
  "solver_config": { "mode": "solve", "time_limit_sec": 10 }
}
