{
  "schema_version": "0.1",
  "calendar": {
    "weeks": 1,
    "slots": [{ "id": "mon-1", "day": "monday", "index": 1 }]
  },
  "groups": [{ "id": "g1", "class_teacher_id": "t-correct" }],
  "teachers": [{ "id": "t-correct" }, { "id": "t-wrong" }],
  "rooms": [{ "id": "101" }],
  "subjects": [{ "id": "homeroom" }],
  "lesson_demands": [
    {
      "id": "ch1",
      "group_id": "g1",
      "subject_id": "homeroom",
      "teacher_id": "t-wrong",
      "room_id": "101",
      "lesson_type": "class_hour",
      "hours_per_week": 1
    }
  ],
  "constraints": { "hard": [], "soft": [] },
  "solver_config": { "mode": "solve", "time_limit_sec": 10 }
}
